{
  "expected_disposition": "request_information",
  "input_id": "i-71ac-1",
  "label_id": "l-71ac-1",
  "provenance": {
    "collected_at": "2026-10-10T12:00:00Z",
    "source_id": "s-71ac",
    "source_kind": "synthetic"
  },
  "rationale": "Assistant-authored draft: Ask for the preferred delivery date, time window and timezone; Availability and permission to book have not been established",
  "review": {
    "reviewed_at": null,
    "reviewer_id": null,
    "status": "unreviewed"
  },
  "schema_version": "proofkey-decision-label-v1",
  "source": {
    "case_id": "c-71ac",
    "revision": 1,
    "snapshot_hash": "67f8f11ef8181618b09566f8630099cb035b253d21bf0f76a93b2ca1b78ba917"
  },
  "visibility": "evaluator_only"
}
